{
  "schema_version": "agentic-tactical-plan-v1",
  "campaign_id": "DERIVED_FROM_AUTHORIZED_GOAL",
  "goal_digest": "DERIVED_FROM_AUTHORIZED_GOAL",
  "revision": 0,
  "steps": [],
  "hypotheses": [],
  "blockers": [],
  "active_progress_minutes_since_review": null,
  "review_evidence_ref": "TO_BE_VERIFIED",
  "review_evidence_sha256": "TO_BE_VERIFIED",
  "reviewed_runtime_revision": null,
  "reviewed_runtime_event_seq": null,
  "progress_clock": "HOST_UNVERIFIED_ADVISORY",
  "invocation_permit_issued": false,
  "plan_mode": "UNVERIFIED",
  "progress_tool": "NATIVE_HOST_PROGRESS_UNAVAILABLE"
}
